"A lot of the media &amp; governments is helping on the cover up from any country. Especially anyone from Saudi Arabia, Russia, Israel, UK, &amp; USA who mostly had most affiliations with Epstein. Quite ironic you never seem to be against Israel who also are involved in many cover ups including the Esptein files."
"@RagingFlamesRedGuyAttitude Oh I&#39;m not &quot;against&quot; Quatar, per se, I was just curious as to why they would ive Trump a plane and do this story."
"​@TraceCreates-MusicCBS fired colbert from his own show for Trump, I don&#39;t see a warning on their channel"
Really interesting. Thank you for covering this. I hope people see this video and the good work Ellie &amp; her team are doing.
A trusted news source.
"Fact checking the info is enough for me. Fact checking &#39;people&#39; is generally used as a means to discredit their factual info, not to validate it."
trump into prison right now!
Pedophiles don&#39;t do well in prison.
"Instead of MAGA hats, everyone who has been overtly DEMANING EPSTEIN FILES should just wear T-shirts that say, &quot;throw fresh kill at me, I&#39;m with the media.&quot;"
Hello 🤗 Hihi 😇👍 The Trump Administration doesn&#39;t have the the files... The victims and the hostages have the files.  And everytime you demand more files on &quot;your&quot; deadline you are re-traumatizing the victims ~
Sure buddy 🥴🫠
No. There is evidence in government possession. Stop it.
The victims say they want the files released and the criminals prosecuted.
"Obviously is making distractions, he is trying to win time to hide whatever he thinks he could out him behind bars , let’s be honest what will be other solution ? It’s so easy to see that is everything made up , including the attack he suffer , everything is fake wake up America ."
"There&#39;s a BIG PROBLEM right there when paralegals, lawyers, doctors, and psychoanalysts are contributing helpers...."
Ty Ellie!
"<b>*WARNING*</b> Until the Epstein files are released, keep Donald J. Trump away from little kids. <b>*WARNING*</b><br><br>The only things safe in America is the Epstein files!<br><br>Fox🚮EWs assist in the coverup is <b>*MASSIVE!!!*</b>"
The CIA has a long history of making disguises and face masks faking an Epswine death is childs play for them
You could be right but there is no concrete evidence
@pork-techpty3078 What is concrete he didn&#39;t care an had his kids around multi child predz and took suggestive pics that would lure those men tbw anyways knowingly or not. Ppl are most uneducated on this topic. The creation of them and what they do.
@msitalianatheist without evidence there is nothing
@pork-techpty3078 Were you up in here with these men? I was as a kid. Financials.
The ONLY thing safe in America is the Epstein files!!!
😅😅😅😅😅😅😅
Muy cierto !!
Heidi klum
NOT for long the Republican MAGA verse is going to destroy the party as the trump rumps war and lie till they die.
"Qatar is mentioned More than 1500 times and Qatar ruling royal family by names has been mentioned more than 250 times..<br>Crazy fact : Isreal, Qatar and Turkey are involved directly in child trafficking and killing..<br>Turkey is used as hub to keep young trafficked girls and Qatar royal family were ones who involved in abusing those young ones..."
Go Ellie! Expose them!
Ellie has done an amazing job! Her team is doing an amazing job.
Release the files
No redacted files!
Release  the sewage  and its critters ! Why hide and cover the stench?
"People say we elected him, when there&#39;s colleges that have votes that outweigh ours by ALOT. America didnt want a woman president, especially not a woman of color. He promised them ridiculous bullshit and they ate it all up. <br>Now look at us now."
Unfortunately... many Americans are so ill informed! Nor do they seem to care to be informed! NOT all... lets get that straight :)
Iz&#39;s very very sad instaedof a very very clever woman you prefered a criminal corrupt criminal monster
​@ElkeBressan-bg2qg that&#39;s the racism and oligarchy of the corrupt America we unfortunately live in. We Have to stand up or be stomped down.
@SeychellesAyel12 Kamala &amp; Walz would have been just as bad albeit in different ways
"Blackmail on Trump, congress, business CEOs, political figures all needs to be exposed!"
And the rest of the world suffer from it
"@medlk7779NO! No, we wouldn’t because we already are! RELEASE THE PHILES AND GET EVERY ONE OF THEM OUT!!!! 🎉"
@medlk7779keep defending those pedos
"​@fridajunkieyou misunderstood me I ,m not defand any one , the comment say that UsA official are being blackmail, and I said the rest of the world suffer from it because they will be infecting all the global not only USA , as you see happening now ."
